<?xml version="1.0" encoding="utf-8"?>
<wii:instrument xmlns:wii="http://www.wwidesigner.com/Instrument"
	xmlns:xsi="http://www.w3.org/2001/XMLSchema-instance"
	xsi:schemaLocation="http://www.wwidesigner.com/Instrument ../Instrument.xsd ">
	<name>D NAF</name>
	<description>7-hole NAF, key of D, A=432</description>
	<lengthType>in</lengthType>
	<mouthpiece>
		<position>0</position>
		<fipple>
			<windowLength>0.15</windowLength>
			<windowWidth>0.64</windowWidth>
			<fippleFactor>0.91</fippleFactor>
			<windowHeight>0.20</windowHeight>
			<windwayLength>1.50</windwayLength>
			<windwayHeight>0.031</windwayHeight>
		</fipple>
	</mouthpiece>
	<borePoint>
		<borePosition>0</borePosition>
		<boreDiameter>1.16</boreDiameter>
	</borePoint>
	<borePoint>
		<borePosition>9.8</borePosition>
		<boreDiameter>1.16</boreDiameter>
	</borePoint>
	<borePoint>
		<borePosition>13.3</borePosition>
		<boreDiameter>1.06</boreDiameter>
	</borePoint>
	<hole>
		<name>7</name>
		<borePosition>5.6</borePosition>
		<diameter>0.284</diameter>
		<height>0.18</height>
		<innerCurvatureRadius>0.02</innerCurvatureRadius>
	</hole>
	<hole>
		<name>6</name>
		<borePosition>6.85</borePosition>
		<diameter>0.328</diameter>
		<height>0.18</height>
		<innerCurvatureRadius>0.02</innerCurvatureRadius>
	</hole>
	<hole>
		<name>5</name>
		<borePosition>8.1</borePosition>
		<diameter>0.312</diameter>
		<height>0.18</height>
		<innerCurvatureRadius>0.02</innerCurvatureRadius>
	</hole>
	<hole>
		<name>4</name>
		<borePosition>10.3</borePosition>
		<diameter>0.403</diameter>
		<height>0.18</height>
		<innerCurvatureRadius>0.02</innerCurvatureRadius>
	</hole>
	<hole>
		<name>3</name>
		<borePosition>11.55</borePosition>
		<diameter>0.337</diameter>
		<height>0.18</height>
		<innerCurvatureRadius>0.02</innerCurvatureRadius>
	</hole>
	<hole>
		<name>2</name>
		<borePosition>12.75</borePosition>
		<diameter>0.158</diameter>
		<height>0.10</height>
		<innerCurvatureRadius>0.02</innerCurvatureRadius>
	</hole>
	<hole>
		<name>1</name>
		<borePosition>12.80</borePosition>
		<diameter>0.172</diameter>
		<height>0.10</height>
		<innerCurvatureRadius>0.02</innerCurvatureRadius>
	</hole>
	<termination>
		<flangeDiameter>1.44</flangeDiameter>
	</termination>
</wii:instrument>











